{
  "toolCallId": "55555555-5555-4555-8555-555555555555",
  "sessionId": "33333333-3333-4333-8333-333333333333",
  "playerUuid": "44444444-4444-4444-8444-444444444444",
  "tool": "server.recipe.lookup",
  "sequence": 0,
  "status": "succeeded",
  "source": "server_registry",
  "trust": "authoritative",
  "result": {
    "recipeCount": 1
  },
  "error": null
}
